{
  "library": {
    "name": "@your-org/react-analytics-ui",
    "version": "1.0.0",
    "description": "Context-aware UI component library with built-in analytics capabilities",
    "framework": "React",
    "typescript": true,
    "repository": "https://github.com/rvu-richard-griffiths/react-analytics-test",
    "keywords": [
      "react",
      "ui",
      "components",
      "analytics",
      "tracking"
    ]
  },
  "installation": {
    "command": "npm install @your-org/react-analytics-ui",
    "peerDependencies": {
      "react": "^18.0.0",
      "react-dom": "^18.0.0"
    }
  },
  "setup": {
    "provider": {
      "import": "import { AnalyticsProvider } from '@your-org/react-analytics-ui';",
      "required": true,
      "description": "Wrap your app with AnalyticsProvider to enable analytics tracking",
      "usage": "<AnalyticsProvider adapter={analyticsAdapter}>\n  <App />\n</AnalyticsProvider>",
      "props": {
        "adapter": {
          "type": "AnalyticsAdapter",
          "required": false,
          "description": "Analytics adapter to integrate with your analytics platform"
        },
        "enabled": {
          "type": "boolean",
          "required": false,
          "default": true,
          "description": "Enable or disable analytics tracking globally"
        }
      }
    },
    "adapter": {
      "interface": "AnalyticsAdapter",
      "description": "Implement this interface to integrate with any analytics platform",
      "structure": {
        "track": "(event: AnalyticsEvent) => void | Promise<void>"
      },
      "examples": {
        "console": "const consoleAdapter: AnalyticsAdapter = {\n  track: (event) => console.log('[Analytics]', event)\n};",
        "googleAnalytics": "const gaAdapter: AnalyticsAdapter = {\n  track: (event) => {\n    gtag('event', event.eventType, {\n      component_type: event.componentType,\n      component_id: event.componentId,\n      ...event.metadata\n    });\n  }\n};",
        "segment": "const segmentAdapter: AnalyticsAdapter = {\n  track: (event) => {\n    analytics.track(event.eventType, {\n      componentType: event.componentType,\n      componentId: event.componentId,\n      ...event.metadata\n    });\n  }\n};"
      }
    }
  },
  "components": [
    {
      "name": "Button",
      "import": "import { Button } from '@your-org/react-analytics-ui';",
      "description": "Button component with built-in analytics tracking for click events",
      "props": {
        "variant": {
          "type": "'primary' | 'secondary' | 'danger'",
          "default": "primary",
          "description": "Button variant style"
        },
        "size": {
          "type": "'small' | 'medium' | 'large'",
          "default": "medium",
          "description": "Button size"
        },
        "analyticsId": {
          "type": "string",
          "required": false,
          "description": "Optional ID for analytics tracking"
        },
        "analyticsMetadata": {
          "type": "Record<string, any>",
          "required": false,
          "description": "Additional metadata to include in analytics events"
        },
        "disableAnalytics": {
          "type": "boolean",
          "default": false,
          "description": "Disable analytics tracking for this component"
        },
        "onClick": {
          "type": "React.MouseEventHandler<HTMLButtonElement>",
          "required": false,
          "description": "Click event handler"
        },
        "disabled": {
          "type": "boolean",
          "required": false,
          "description": "Disable the button"
        },
        "children": {
          "type": "ReactNode",
          "required": true,
          "description": "Button content"
        }
      },
      "events": [
        {
          "name": "click",
          "description": "Fired when the button is clicked",
          "eventType": "button_click"
        }
      ],
      "examples": [
        {
          "title": "Basic button",
          "code": "<Button variant=\"primary\" onClick={handleClick}>\n  Submit\n</Button>"
        },
        {
          "title": "Button with analytics",
          "code": "<Button \n  variant=\"primary\" \n  analyticsId=\"submit-form\"\n  analyticsMetadata={{ formName: 'contact', section: 'footer' }}\n  onClick={handleSubmit}\n>\n  Submit Form\n</Button>"
        },
        {
          "title": "Danger button",
          "code": "<Button \n  variant=\"danger\" \n  size=\"small\"\n  analyticsId=\"delete-btn\"\n  onClick={handleDelete}\n>\n  Delete\n</Button>"
        }
      ]
    },
    {
      "name": "TextBox",
      "import": "import { TextBox } from '@your-org/react-analytics-ui';",
      "description": "Text input component with built-in analytics tracking for focus, blur, and change events",
      "props": {
        "label": {
          "type": "string",
          "required": false,
          "description": "Label for the text box"
        },
        "error": {
          "type": "string",
          "required": false,
          "description": "Error message to display"
        },
        "helpText": {
          "type": "string",
          "required": false,
          "description": "Help text to display below the input"
        },
        "analyticsId": {
          "type": "string",
          "required": false,
          "description": "Optional ID for analytics tracking"
        },
        "analyticsMetadata": {
          "type": "Record<string, any>",
          "required": false,
          "description": "Additional metadata to include in analytics events"
        },
        "disableAnalytics": {
          "type": "boolean",
          "default": false,
          "description": "Disable analytics tracking for this component"
        },
        "trackOnChange": {
          "type": "boolean",
          "default": false,
          "description": "Track on change events (can be noisy, disabled by default)"
        },
        "value": {
          "type": "string",
          "required": false,
          "description": "Input value (for controlled components)"
        },
        "onChange": {
          "type": "React.ChangeEventHandler<HTMLInputElement>",
          "required": false,
          "description": "Change event handler"
        }
      },
      "events": [
        {
          "name": "focus",
          "description": "Fired when the input receives focus",
          "eventType": "textbox_focus"
        },
        {
          "name": "blur",
          "description": "Fired when the input loses focus",
          "eventType": "textbox_blur",
          "metadata": "Includes duration (time focused in milliseconds) and hasValue (boolean)"
        },
        {
          "name": "change",
          "description": "Fired when the input value changes (only if trackOnChange is true)",
          "eventType": "textbox_change"
        }
      ],
      "examples": [
        {
          "title": "Basic text input",
          "code": "<TextBox\n  label=\"Email\"\n  placeholder=\"Enter your email\"\n  value={email}\n  onChange={(e) => setEmail(e.target.value)}\n/>"
        },
        {
          "title": "Text input with analytics",
          "code": "<TextBox\n  label=\"Email Address\"\n  placeholder=\"you@example.com\"\n  analyticsId=\"signup-email\"\n  analyticsMetadata={{ formName: 'signup', step: 1 }}\n  value={email}\n  onChange={(e) => setEmail(e.target.value)}\n/>"
        },
        {
          "title": "Text input with error",
          "code": "<TextBox\n  label=\"Password\"\n  type=\"password\"\n  error={passwordError}\n  helpText=\"Must be at least 8 characters\"\n  value={password}\n  onChange={(e) => setPassword(e.target.value)}\n/>"
        }
      ]
    },
    {
      "name": "DatePicker",
      "import": "import { DatePicker } from '@your-org/react-analytics-ui';",
      "description": "Date picker component with built-in analytics tracking for date selection and calendar interactions",
      "props": {
        "value": {
          "type": "Date | null",
          "required": false,
          "description": "The selected date value"
        },
        "onChange": {
          "type": "(date: Date | null) => void",
          "required": false,
          "description": "Callback when date changes"
        },
        "minDate": {
          "type": "Date",
          "required": false,
          "description": "Minimum selectable date"
        },
        "maxDate": {
          "type": "Date",
          "required": false,
          "description": "Maximum selectable date"
        },
        "format": {
          "type": "'MM/DD/YYYY' | 'DD/MM/YYYY' | 'YYYY-MM-DD'",
          "default": "MM/DD/YYYY",
          "description": "Date format for display"
        },
        "analyticsId": {
          "type": "string",
          "required": false,
          "description": "Optional ID for analytics tracking"
        },
        "analyticsMetadata": {
          "type": "Record<string, any>",
          "required": false,
          "description": "Additional metadata to include in analytics events"
        },
        "disableAnalytics": {
          "type": "boolean",
          "default": false,
          "description": "Disable analytics tracking for this component"
        },
        "disabled": {
          "type": "boolean",
          "required": false,
          "description": "Disable the date picker"
        }
      },
      "events": [
        {
          "name": "open",
          "description": "Fired when the calendar is opened",
          "eventType": "datepicker_open"
        },
        {
          "name": "close",
          "description": "Fired when the calendar is closed",
          "eventType": "datepicker_close",
          "metadata": "Includes duration (time opened in milliseconds)"
        },
        {
          "name": "select",
          "description": "Fired when a date is selected",
          "eventType": "datepicker_select",